<?xml version="1.0" encoding="UTF-8"?>
<xs:schema xmlns:xs="http://www.w3.org/2001/XMLSchema">
    <xs:element name="proyectos">
        <xs:complexType>
            <xs:sequence>
                <xs:element name="casos" maxOccurs="unbounded">
                    <xs:complexType>
                        <xs:sequence>
                            <xs:element name="id" type="xs:string"/>
                            <xs:element name="nombre" type="xs:string"/>
                            <xs:element name="descripcion" type="xs:string"/>
                        </xs:sequence>
                        <xs:attribute name="categoria" type="xs:string" use="required"/>
                    </xs:complexType>
                </xs:element>
            </xs:sequence>
        </xs:complexType>
                                    <!-- </xs:simpleContent>
                                </xs:complexType>
                            </xs:element>
                            <xs:element name="descripcion" type="xs:string"/>
                        </xs:sequence>
                        <xs:attribute name="categoria" type="xs:string" use="required"/>
                    </xs:complexType>
                </xs:element>
            </xs:sequence>
        </xs:complexType> -->
    </xs:element>

</xs:schema>